,hashtags,link,tweet,sentiment
170,"['#blacklivesmatter', '#chinese', '#elephantdeath', '#food', '#georgefloydfuneral', '#indianarmy', '#kalu', '#master', '#mumbai', '#onlyfans', '#onthisday', '#postponeneet', '#quotes', '#studentlivesmatter', '#tuesdayvibes', '#usaonfire', '#unlock1']",https://twitter.com/99Moonmen/status/1270476702167293956,if you think you need to follow truth and avoide fake news then follow me blacklivesmatter chinese virus elephantdeath food georgefloydfuneral indianarmy kalu master mumbai onlyfans onthisday postponeneet quotes studentlivesmatter tuesdayvibes usaonfire unlock,neutral
171,"['#unlock1', '#vickykaushal', '#urithesurgicalstrike', '#howsthejosh']",https://twitter.com/PeepingMoon/status/1270471343645941760,how s the distance questions mumbai police on its social media amidst unlock with a vickykaushal twist urithesurgicalstrike howsthejosh,neutral
172,"['#communityspread', '#delhi', '#mumbai', '#lockdown', '#indiafightscorona', '#unlock1', '#covid_19india']",https://twitter.com/varunnorway/status/1270448291810021380,if you have communityspread as delhi mumbai do it is impossible to control the spread without a lockdown the alternative is an incredible tragedy to achieve herd immunity around deaths per city the r is too high indiafightscorona unlock covid india,worry
173,"['#delhi', '#mumbai', '#indiafightscorona', '#unlock1']",https://twitter.com/varunnorway/status/1270446767360876545,people need to realise that delhi and mumbai will go into a complete lockdown soon they shouldn t just blame the government for their inability to produce enough oxygen beds it has been an impossible task for all cities horrifying projections indiafightscorona unlock,sadness
174,"['#lockdown', '#unlock1', '#staysafe', '#becareful', '#helpanimals']",https://twitter.com/steffyshappypa1/status/1270434383778856962,unlock be careful and extra cautious lockdown unlock staysafe becareful helpanimals navi mumbai new mumbai india,worry
175,"['#annasahebmisal', '#nmmt', '#navimumbai', '#unlock1']",https://twitter.com/NaviMumbaiNet/status/1270433320665444352,find out all bus routes of nmmt which operate from june annasahebmisal nmmt navimumbai unlock,neutral
176,"['#nepal', '#nepalindiaborder', '#indianarmy', '#indiachinafaceoff', '#indiafightscorona', '#arvindkejriwal', '#coronavirus', '#gunjansaxena', '#janhvikapoor', '#kalu', '#ladakh', '#master', '#mumbai', '#modiwonchinirahulfail', '#obamagate', '#postponeneet', '#rishibagree', '#studentlivesmatter', '#tamilnadu', '#unlock1', '#vocalforlocal']",https://twitter.com/BaazigarSheru/status/1270424439432282112,nepal nepalindiaborder indianarmy indiachinafaceoff indiafightscorona arvindkejriwal coronavirus gunjansaxena janhvikapoor kalu ladakh master mumbai modiwonchinirahulfail obamagate postponeneet rishibagree studentlivesmatter tamilnadu unlock vocalforlocal,neutral
177,"['#unlock1', '#stayhome', '#selfie', '#instagram', '#instaclick', '#quarantine']",https://twitter.com/ShanawazChinoy/status/1270409798094331907,unlock stayhome selfie instagram instaclick quarantine mumbai maharashtra,neutral
178,"['#unlock1', '#mumbai']",https://twitter.com/DinooMarino/status/1270408400497762307,they should have unlock at all with highest deaths and infections guess we have some visionaries in these state governments mumbai bmc is now allowing shops to be open all throughout the day as per pre covid timings super we thought out clap clap clap,worry
179,"['#covid__19', '#coronavirus', '#covid19india', '#unlock1', '#tuesdayvibes', '#wednesdaymorning', '#india', '#indiafightscoronavirus', '#memes', '#mumbai', '#memesdaily', '#memes2020', '#arnabgoswami', '#indianews', '#indiatoday', '#covid_19', '#wednesdayvibes', '#tuesdayvibes', '#lockdownfailed']",https://twitter.com/RizwanSoorya1/status/1270407046517657609,kya mast plan hay re baba covid coronavirus covid india unlock tuesdayvibes wednesdaymorning india indiafightscoronavirus memes mumbai memesdaily memes arnabgoswami indianews indiatoday covid wednesdayvibes tuesdayvibes lockdownfailed,neutral
180,"['#coronavirus', '#unlock1', '#shahrukhkhan', '#shahrukhkhanfan', '#covid_19', '#memesdaily', '#bjp', '#mumbai', '#delhi', '#narendermodi', '#lockdownextension', '#coronawarriors', '#vaccine', '#newshot', '#shahrukh', '#asksrk']",https://twitter.com/DramaFlick/status/1270406051565916160,don t be so badshah guys stay safe coronavirus unlock shahrukhkhan shahrukhkhanfan covid memesdaily bjp mumbai delhi narendermodi lockdownextension coronawarriors vaccine newshot shahrukh asksrk,joy
181,"['#unlock1', '#lockdown', '#covid__19']",https://twitter.com/Yash_Railfan/status/1270405916152614917,best bus mumbai unlock lockdown covid mt depot buses operating on route ltd for higher frequency buses parked on mg road waiting for departure ltd at borivali stn safety livery bus from w operating on ltd cc,worry
182,"['#ghantatime', '#unlock1', '#mumbai', '#covid19india']",https://twitter.com/Nimitiwari/status/1270401575299641344,ghantatime really need to know the ground reality how are the jobs of the middle class coming back to its full state of consciousness in unlock state when will furlough leave without pay sessions end for hardworking corporate professionals mumbai covid india,worry
183,"['#mumbai', '#unlock1']",https://twitter.com/mumbairailusers/status/1270394222873464832,mumbai unlock day confusion over govts rules changes in work habits marks day one of mission begin again,sadness
184,"['#factofactcheck', '#westbengal', '#unlock1', '#mumbai']",https://twitter.com/Facto_news/status/1270385848790298624,west bengal s video of people boarding the bus is going viral as crowded mumbai s best bus factofactcheck westbengal unlock mumbai,happiness
185,"['#उद्धव', '#महाराष्ट्र', '#चीन', '#वुहान', '#मुंबई', '#covid', '#कोरोना', '#coronaupdates', '#mumbai', '#maharashtrafightscorona', '#wuhanflu', '#chinesevirus', '#bollywood', '#uddhavthackeray', '#unlock1', '#negative', '#justiceforstudents', '#modiwonchinirahulfail']",https://twitter.com/Rajesh_Dubey_/status/1270370324664717312,covid coronaupdates mumbai maharashtrafightscorona wuhanflu chinesevirus bollywood uddhavthackeray unlock negative justiceforstudents modiwonchinirahulfail,neutral
186,[],https://twitter.com/BeardWalaChokra/status/1270364863211220992,friend kya hoga mumbai ka after unlock me,joy
187,"['#unlockone', '#unlock1', '#missionbeginagain', '#mumbai', '#balconyphotography', '#iphonephotography', '#kumargautam']",https://twitter.com/Kumargautamkg/status/1270361062672490497,unlockone unlock missionbeginagain mumbai balconyphotography iphonephotography kumargautam,neutral
188,['#unlock1'],https://twitter.com/Indradev_007/status/1270346349008097282,mumbai heavy traffic at jogeshwari west near jvlr fly over unlock,neutral
189,"['#wassupmumbai', '#unlock1']",https://twitter.com/Wassup_Mumbai/status/1270345490991849475,unlock top rule please wear face mask our humble request is go out only if absolutely necessary wassupmumbai unlock,happiness
190,"['#humanityfirst', '#convid19', '#unlock1', '#saveself', '#mumbai']",https://twitter.com/DHARMESHRAJPUT0/status/1270334304086786048,humanityfirst convid unlock saveself mumbai dosto me app sabhi se ek baat kehna chahta hu ki sarkar ha but a safal hai police ha lachar ha doctors ha insaniyat nhi hospitals ha usse koi madat nhi hum aam insan ha hume kisi bhi tarah jiveet rehne ke bare me sochna ha bas,happiness
191,"['#unlock1', '#restartingindia']",https://twitter.com/CNBCTV18News/status/1270332331799097344,on day of unlock our reporters stepped out to have a meal at cyberhub in gurugram shop at a raymond store spoke to small business owners at what was once a bustling commercial district in mumbai special reports on restartingindia,happiness
192,['#unlock1'],https://twitter.com/VeeraJain/status/1270330211809112065,all those who ask me how s mumbai doing here s the answer we re preparing to flatten the curve together with unlock i guess we re doing it right right,happiness
193,"['#mumbai', '#unlock1']",https://twitter.com/editorji/status/1270328506686177280,huge relief for citizens shops in mumbaiwill stay open beyond pm says bmc unlock,worry
194,"['#coronavirus', '#covid_19', '#lockdown5', '#unlock1', '#mumbai', '#socialdistancing']",https://twitter.com/LoksattaLive/status/1270325482609729536,via coronavirus covid lockdown unlock mumbai socialdistancing,neutral
195,"['#unlock1', '#mumbai', '#juhu', '#beach']",https://twitter.com/TheSarlashkar/status/1270325130841993216,calm and serene unlock mumbai juhu beach,neutral
196,"['#unlock1', '#worldoceansday', '#mumbai', '#juhubeach', '#saveenvironment', '#cleanbeach', '#coronaeffect']",https://twitter.com/AvezFaiz/status/1270324451545137153,juhu beach mumbai after lockdown unlock worldoceansday mumbai juhubeach saveenvironment cleanbeach coronaeffect video link at juhu beach mumbai,neutral
197,"['#unlock1', '#anilkapoor', '#juhu', '#workout', '#fitness', '#exercise', '#health', '#healthylifestyle', '#goals', '#walk', '#stayhome', '#lockdown', '#bollywood', '#movietalkies', '#tuesdayvibes', '#tuesdaymotivation']",https://twitter.com/MovieTalkies/status/1270323563635990529,as mumbai eases its lockdown in unlock the super fit takes a walk around juhu to stay healthy anilkapoor juhu workout fitness exercise health healthylifestyle goals walk stayhome lockdown bollywood movietalkies tuesdayvibes tuesdaymotivation,happiness
198,"['#unlock1', '#coronavirusoutbreak']",https://twitter.com/livemint/status/1270322022069854209,unlock mumbai tweaks norms lets shops remain open for full working hours pathakkalpana reports coronavirusoutbreak,happiness
199,"['#unlock1', '#mumbai', '#beach', '#gardenshour', '#crowd', '#communityspread']",https://twitter.com/TheMahaMTB/status/1270321848325111809,unlock mumbai beach gardenshour crowd communityspread,neutral
200,"['#kareenakapoorkhan', '#saifalikhan', '#mumbai', '#marinedrive', '#taimur', '#tv', '#coronavirus', '#celebrity', '#video', '#unlock1']",https://twitter.com/Showsha_in/status/1270317217142452226,kareenakapoorkhan and saifalikhan stepped out in mumbai s marinedrive on sunday they were warned by a cop as taimur tagged along with his parents tv coronavirus celebrity video unlock,neutral
201,[],https://twitter.com/munshi1857/status/1270315817834434566,what an idea sir ji this is how unlock looks like wonder what and would be just imagine when mumbai locals resume services,happiness
202,"['#mumbai', '#covid19india', '#indianarmy', '#unlock1', '#coronawarriors', '#coronavirus']",https://twitter.com/saurabhs0607/status/1270315330829762561,what happened to this drug any report anyone can confirm mumbai covid india indianarmy unlock coronawarriors coronavirus,sadness
203,"['#unlock1', '#covid19', '#covid']",https://twitter.com/PIBMumbai/status/1270311586931118080,as we enter unlock phase we need to be more disciplined in adopting covid appropriate behaviour let us not forget the social vaccine against covid through strict adherence of norms of physical distancing hand hygiene and mask face covers,happiness
204,"['#mumbai', '#unlock1']",https://twitter.com/ABPNews/status/1270310811953586178,mumbai bmc issues revised guidelines for unlock shops to open in left right lane rule details,neutral
205,['#unlock1'],https://twitter.com/withSNirupam/status/1270307491633643524,social distancing out coronavirus in with no proper procedure mumbai is bound to face huge challenges amid unlock dark days ahead,worry
206,"['#thackeraygandhipawar', '#congresssenancp', '#mahavinashdhokaaghadi', '#maharashtragovt', '#mumbai', '#maharashtra', '#unlock1', '#socialdistancing', '#lockdown']",https://twitter.com/hitesh_thakkar3/status/1270306911980859393,thackeraygandhipawar congresssenancp mahavinashdhokaaghadi maharashtragovt is not doing well in mumbai maharashtra since d unlock ppl r not following socialdistancing at all as evry on roads each has explain n tell again n again there s nothing like lockdown,worry
207,"['#kolkata', '#mumbai', '#socialdistancing', '#coronavirus', '#unlock1', '#tmc', '#speakupdelhi']",https://twitter.com/sarang160499/status/1270303079867600896,social distancing being strictly followed by people kolkata mumbai socialdistancing coronavirus unlock tmc speakupdelhi,happiness
208,[],https://twitter.com/ankita_bhattar/status/1270298490158153733,delhi deputy cm manish sisodia claims that delhi will have lacs covid cases by july end hope mumbai does some analysis takes the appropriate measures before the city is exploded with virus post unlock wasn t lockdown enough to borrow time develop medical facilities,sadness
209,"['#bmc', '#unlock1', '#mumbai', '#covid19']",https://twitter.com/firstpost/status/1270292250220802051,bmc has revised its unlock guidlines as per the new guidelines shops in mumbai will be allowed to stay open for the full working hours for six days in a week however shops will remain closed on sundays follow live updates on covid,sadness
210,['#unlock1'],https://twitter.com/sajeshsudhanshu/status/1270289551072718848,unlock mumbai beach lokhandwala infinty mall mumbai stree via unlock,neutral
211,"['#mumbai', '#unlock1', '#bmc']",https://twitter.com/indiatvnews/status/1270286642733961216,unlock bmc issues new guidelines for mumbai allows shops to open with left right lane rule via mumbai unlock bmc,worry
212,"['#mumbai', '#unlock1', '#lockdown5']",https://twitter.com/LeoThomasekar/status/1270283575972122624,sir companies have declared compulsory attendance orelse unpaid leave putting our lives at stake complete ignorance of the pandemic situation mumbai unlock lockdown,sadness
213,"['#unlock1', '#unlockfirefox', '#unlocklectro', '#bikelife', '#powai', '#powaipedals', '#mumbai', '#pedaltoplaces', '#immunebooster', '#fitnessjourney', '#postlockdownlife', '#ebikes']",https://twitter.com/he21im32/status/1270281410004176897,it s time to unlock experience the joy of biking try something new feel alive start cycling be the change you want to see unlock unlockfirefox unlocklectro bikelife powai powaipedals mumbai pedaltoplaces immunebooster fitnessjourney postlockdownlife ebikes at powai lake promenade,worry
214,['#unlock1'],https://twitter.com/smitadeshmukh/status/1270281005652496384,my friend gautam sends this pic of gurukripa sion central mumbai best known for their samosas and chole guess mumbai has decided to go all out social distancing what s that unlock,sadness
215,"['#mumbaifightscovid19', '#mumbai', '#unlock1']",https://twitter.com/PriyaDalal_/status/1270274417935945730,ward wise helpline numbers issued by mumbaifightscovid mumbai unlock,neutral
216,"['#nagpur', '#covid_19', '#mumbai', '#unlock1']",https://twitter.com/Yogeshsagar09/status/1270272778776842240,if such is the level of negligence at home minister home ground nagpur the overall preparedness for covid in the state especially mumbai post the unlock is highly questionable what action is the mh govt going to take,sadness
217,"['#coronavirus', '#chinavirus', '#unlock1', '#modigovtfailedlockdown']",https://twitter.com/badal_taneja/status/1270271200212783104,why do businesses have to open by putting lives at risk this is a partial opening coronavirus chinavirus is still spreading in mumbai unlock modigovtfailedlockdown,worry
218,"['#covid_19', '#mumbai', '#unlock1']",https://twitter.com/PriyaDalal_/status/1270264458758090753,covid patient s plight in mumbai unlock,neutral
219,"['#unlock1', '#mumbai', '#mumbairains', '#missionbeginagain']",https://twitter.com/Akhil_C/status/1270263537294868481,bombay was famous for its orderly queue for public transport best buses taxis autos traffic discipline well bombay has changed mumbai isnt the same mumbai needs to rediscover itself unlock mumbai mumbairains missionbeginagain,sadness
220,"['#mumbai', '#unlock1']",https://twitter.com/smitadeshmukh/status/1270261297255297024,four hours by road to attend eight hours at work story of amchi mumbai sigh unlock,happiness
221,"['#mumbai', '#maharashtra', '#unlock1', '#covid', '#tuesdayvibes']",https://twitter.com/TheFearlessInd1/status/1270260266496901131,social distancing at its best in mumbai blames the central govt for locking down the nation without much preparation what preparations did the maharashtra govt did before announcing the unlock rather you have unlocked another covid spike tuesdayvibes,worry
222,"['#kamyapunjabi', '#covid19', '#unlock1']",https://twitter.com/DelhiTimesTweet/status/1270259960396431363,actress shared a pic of her with her daughter wearing ppe kits and face shields as the duo travelled to mumbai kamyapunjabi covid unlock,joy
223,"['#mumbai', '#stayhomestaysafe', '#unlock1']",https://twitter.com/notnewnaveen/status/1270253969281933313,creators and influencers especially please take a moment to read if possible mumbai stayhomestaysafe unlock,worry
224,"['#unlock1', '#mumbai', '#mumbaifightscovid19', '#maharashtrabachao']",https://twitter.com/hemant_parida/status/1270245155690307584,unlock condition in mumbai mumbaifightscovid maharashtrabachao,neutral
225,"['#lockdown5', '#unlock1', '#mumbai', '#bestbus']",https://twitter.com/LoksattaLive/status/1270242305782321152,lockdown unlock mumbai bestbus,neutral
226,"['#unlock1', '#coronavirus', '#covid_19india', '#mumbai']",https://twitter.com/Gershwynp/status/1270240835867721728,unlock just a bad decission we could have waited for another weeks coronavirus covid india mumbai,sadness
227,"['#coronavirus', '#covid__19', '#india', '#mumbai', '#unlock1']",https://twitter.com/DeewanaShetty/status/1270240045925109761,and here we enter into bhagwan bharose coronavirus covid india mumbai unlock,neutral
228,"['#mumbai', '#missionbeginagain', '#unlock1']",https://twitter.com/kunnal/status/1270239937892216833,scary and we are opening up mumbai does it make sense missionbeginagain unlock,sadness
229,"['#unlock1', '#mumbailockdown']",https://twitter.com/Komal43771823/status/1270238404123308033,unlock mumbai best service resumes what are we getting now a bus full of corona unlock mumbailockdown,worry
230,"['#mumbai', '#coronaupdate', '#icu', '#covid19', '#unlock1']",https://twitter.com/VineetaDwivedi/status/1270236110090887172,th june mumbai coronaupdate total k cases single highest day toll of of the l tested are positive doubling in days k cases added in may alone icu beads occupied there are only icu beds covid unlock,worry
231,"['#marinedrive', '#socialdistancing', '#mumbai', '#unlock1']",https://twitter.com/lvmillenium/status/1270231294912237570,discipline without education is better then the education without discipline marinedrive socialdistancing mumbai unlock,neutral
232,"['#unlock1', '#mumbai', '#mumbaifightscovid19', '#maharashtrabacha', '#uddhavresign']",https://twitter.com/hemant_parida/status/1270231202922782720,unlock situations in mumbai mumbaifightscovid maharashtrabacha uddhavresign,neutral
233,"['#missionbeginagain', '#unlock1']",https://twitter.com/RiaRevealed/status/1270225918015926272,mumbai back to square one missionbeginagain unlock,neutral
234,"['#covid19', '#bkc', '#mumbai', '#coronavirus', '#restartingindia', '#unlock1']",https://twitter.com/prathod2008/status/1270225761048248320,some more visuals from the site where phase of the covid hospital for critical patients is being constructed at bkc mumbai by the coronavirus restartingindia unlock,sadness
235,"['#sakal', '#covid19', '#sakalnews', '#thane', '#mumbai', '#corona', '#lockdowneffect', '#coronavirus', '#marathinews', '#missionbeginagain', '#unlock1']",https://twitter.com/SakalMediaNews/status/1270225460790624256,breaking sakal covid sakalnews thane mumbai corona lockdowneffect coronavirus marathinews missionbeginagain unlock,sadness
236,"['#unlock1', '#unlockyouropportunity', '#realestate', '#bestinvestment', '#investmentproperty', '#property', '#businessideas', '#bestdeals', '#bkandharigroup', '#bkandhariproperties', '#mumbai']",https://twitter.com/BKandhari_Prop/status/1270221132948365320,our sales team are fully equipped with protective gears for more details call b kandhari group unlock unlockyouropportunity realestate bestinvestment investmentproperty property businessideas bestdeals bkandharigroup bkandhariproperties mumbai,neutral
237,"['#covidー19', '#unlock1', '#restartingindia', '#coronavirus', '#maharashtra', '#mumbailockdown']",https://twitter.com/CNBCTV18News/status/1270217045372628992,coronavirus news live updates with over covid cases mumbai alone accounts for of maharashtra s over cases covid unlock restartingindia coronavirus maharashtra mumbailockdown,neutral
238,"['#unlock1', '#mumbai', '#mumbaitraffic', '#mumbaibachao', '#mumbaifightscovid19']",https://twitter.com/hemant_parida/status/1270209625644838913,unlock in mumbai mumbaitraffic mumbaibachao mumbaifightscovid,neutral
239,"['#aamchi_mumbai', '#ram', '#virar', '#unlock1', '#mumbai']",https://twitter.com/Chatraraj_S/status/1270202687867551744,this is aamchi mumbai ram bharose andher nagri chaupat raja virar phulpada am line for best bus unlock mumbai,neutral
240,"['#mumbai', '#covid19', '#missionbeginagain', '#unlock1', '#indiafightscorona']",https://twitter.com/kunnal/status/1270197003826237441,mumbai has crossed k covid cases missionbeginagain unlock indiafightscorona,neutral
241,"['#unlock1', '#mumbai', '#morningthoughts', '#riseandshine']",https://twitter.com/aartiinaagpal/status/1270195800186839040,morning motivation unlock mumbai morningthoughts riseandshine,happiness
242,"['#mumbaimerijaan', '#mumbaikars', '#highspirits', '#mumbailockdown', '#unlock1']",https://twitter.com/urvashikhona/status/1270195399723061251,lastly financial capital is known as mumbaimerijaan but mumbaikars dont forget corona cases in mumbai are highest in country n with over stretched health system its imp that one remains cautioned survive in city of dreams wid same amt of highspirits mumbailockdown unlock,joy
243,"['#mumbai', '#mumbaitraffic', '#unlock1']",https://twitter.com/BigTownPost/status/1270192457423024129,this how people going to work in mumbai mumbaitraffic unlock,sadness
244,"['#covid19india', '#mumbai', '#unlock1', '#coronavirus', '#lockdown5', '#indiafightscorona']",https://twitter.com/ProCloud_/status/1270189224701067264,covid india mumbai unlock coronavirus lockdown indiafightscorona yeh hai mumbai meri jaan,neutral
245,"['#mumbaikar', '#mumbai', '#unlock1']",https://twitter.com/echoman911/status/1270176396325687296,bless each mumbaikar mumbai travelling to work or shop travel safe and be kind to others too unlock doesn t seem right,happiness
246,"['#mumbaikar', '#mumbai', '#coronaupdate', '#coronaoutbreak', '#unlock1']",https://twitter.com/Arvindr66397850/status/1270158818127876096,as we all know of offices are open in mumbai so mumbaikar mumbai stay safe and stay fit coronaupdate coronaoutbreak unlock,happiness
247,"['#roseringedparakeets', '#parrots', '#socialdistancing', '#bandraeast', '#mumbai', '#india', '#unlock1']",https://twitter.com/magic_eye/status/1270147958818947077,mumbai daily unlocked but roseringedparakeets parrots socialdistancing bandraeast mumbai india unlock,neutral
248,"['#comparision', '#deltacorp', '#unlock1', '#lasvegas', '#goa', '#bigbulls', '#warrenbuffett', '#rj', '#iqbalmenon', '#worli', '#ceejay', '#mumbai', '#hft', '#colocation', '#servers']",https://twitter.com/kokilaben2019/status/1270114079806545921,comparision of deltacorp casino company of india with mgm date unlock lasvegas vs goa bigbulls warrenbuffett of bharat rj iqbalmenon worli ceejay house mumbai hft colocation of servers india,neutral
249,"['#socaildistancing', '#unlock1', '#india', '#mumbai', '#インドメモ', '#インドニュース', '#indiafightscoronavirus']",https://twitter.com/yogimanish_/status/1270075708082139136,socaildistancing unlock in india mumbai indiafightscoronavirus,neutral
250,"['#mumbai', '#unlock1']",https://twitter.com/LeoThomasekar/status/1270065089492574211,mumbai mission infecting again st of unlock and it was crowded everywhere follow gvmnt guidelines please watch the news on unlock mumbai,worry
251,"['#covid19india', '#coronavirusoutbreak', '#covid_19', '#unlock1']",https://twitter.com/dna/status/1270063283437854720,mumbai update total cases cases today death toll deaths today discharged discharged today active cases covid india coronavirusoutbreak covid unlock,sadness
252,"['#covid19india', '#coronavirusoutbreak', '#covid_19', '#unlock1']",https://twitter.com/dna/status/1270062950758268928,covid cases in mumbai near mark death toll touches covid india coronavirusoutbreak covid unlock,neutral
253,"['#mumbai', '#unlock1']",https://twitter.com/jatinjkothari/status/1270058838322851840,with this kind of dedication we will surely defeat corona in mumbai strict rules and actions required in unlock too to flatten the curve,worry
254,"['#biggestmoviesever', '#movielovers', '#stayathome', '#unlock1', '#avengers', '#endgame', '#marvel', '#mcu', '#avengersendgame', '#marvelstudios', '#mumbai']",https://twitter.com/CutyWithBrains/status/1270055652602175493,biggestmoviesever movielovers stayathome unlock avengers endgame marvel mcu avengersendgame marvelstudios mumbai,neutral
255,"['#mumbai', '#unlock1', '#mumbai', '#mumbaiexpressnews', '#mumbailockdown', '#mumbaikars']",https://twitter.com/MumbaiExpress11/status/1270044702289604614,long queues of people waiting for buses seen at various parts of mumbai on the st day of unlock this was as no local train services are started for mumbai mumbaiexpressnews mumbailockdown mumbaikars,neutral
256,['#unlock1'],https://twitter.com/PRERAKOGALA/status/1270042563106439168,how to apply for e pass to move from gujarat to mumbai via road during unlock unlock,neutral
