,hashtags,link,tweet,sentiment
82,"['#love', '#care', '#hope', '#together', '#beauty', '#unlock1', '#sobo', '#mumbai', '#india', '#anahitakapoor']",https://twitter.com/anahita_kapoor/status/1271381936783720450,the way i love myself do u also love me love care hope together beauty unlock sobo mumbai india anahitakapoor,joy
83,['#unlock1'],https://twitter.com/larryhert_10/status/1271381490870386688,finally trains must start in mumbai unlock,happiness
84,"['#unlock1', '#delhi', '#mumbai', '#covid19india', '#coronavirus']",https://twitter.com/patidarsom/status/1271372077723983874,as india reopens under unlock coronavirus infection continue to soar in big cities including delhi mumbai businesses like salons adapt to new normal covid india coronavirus do watch,neutral
85,['#unlock1'],https://twitter.com/FurkhanAhmedFk/status/1271366749460369409,life before and after unlock more people were out on the streets and traffic snarls made a comeback this combination picture shows mumbai s marine drive before and after lockdown,sadness
86,"['#segways', '#coronavirus', '#mumbaionlockdown', '#unlock1']",https://twitter.com/ZEE5News/status/1271361859002626048,mumbai police to patrol marine drive on segways in order to boost social distancing among people and reduce the spread of coronavirus mumbaionlockdown unlock watch,happiness
87,['#unlock1'],https://twitter.com/gujarati_mulgi/status/1271333083317284864,unlock has drowned mumbai cm is a big time failure,neutral
88,"['#lockdown5', '#unlock1', '#covid_19', '#corona', '#delhi', '#mumbai']",https://twitter.com/RisingIndore/status/1271321802417991683,lockdown unlock covid corona delhi mumbai,neutral
89,['#unlock1'],https://twitter.com/Im_MafiaPanda/status/1271319193770582016,mumbai unlock petrol ruk tere ko batata hoon rs,neutral
90,"['#homequarantine', '#mumbai', '#delhi', '#lucknow', '#chennai', '#bengaluru', '#indore', '#india', '#rajasthan', '#haryana', '#indians', '#lockdownindia', '#unlock1', '#modi', '#mumbaikar', '#pune', '#tamilnadu', '#jaipur', '#kolkata', '#up', '#ahmedabad', '#gujarat', '#maharashtra', '#thane', '#indian', '#chembur', '#navimumbai', '#gurgaon']",https://twitter.com/bluetreelakes/status/1271314519533342720,what is homequarantine mumbai delhi lucknow chennai bengaluru indore india rajasthan haryana indians lockdownindia unlock modi mumbaikar pune tamilnadu jaipur kolkata up ahmedabad gujarat maharashtra thane indian chembur navimumbai gurgaon,neutral
91,"['#unlock1', '#mumbai', '#bestbus']",https://twitter.com/LoksattaLive/status/1271299210046877698,unlock mumbai bestbus,neutral
92,"['#unlock1', '#relockdelhi']",https://twitter.com/SumanSaurabh007/status/1271250935465930752,the response of the citizens of delhi and mumbai after unlock is enough to understand why the situation is worsening so fast in these two metro cities the most idiotic senseless people are found in these cities and the blame goes to poor labourers for this relockdelhi,sadness
93,"['#socialdistancing', '#unlock1', '#queensnecklace', '#marinedrive']",https://twitter.com/RaoMandar/status/1271175167415332865,mumbai police at their best socialdistancing unlock queensnecklace marinedrive,neutral
94,"['#covid19', '#unlock1']",https://twitter.com/BalBolkhare/status/1271155589888897024,patients in mumbai in last hours stop public transport buses stop all kind of staff rushing to offices ask shopkeepeers to ensure customers observe social distancing act it should be release and break not just rash acceleration covid unlock,happiness
95,"['#sakal', '#sakalnews', '#viral', '#sakalmedia', '#news', '#mumbai', '#india', '#marathinews', '#maharashtra', '#unlock1', '#china', '#border']",https://twitter.com/SakalMediaNews/status/1271132815334260737,sakal sakalnews viral sakalmedia news mumbai india marathinews maharashtra unlock china border,neutral
96,"['#coronavirus', '#missionbeginagain', '#unlock1']",https://twitter.com/mumbaimatterz/status/1271107832792793088,mumbai coronavirus updates missionbeginagain unlock suspected positive total positive patients deaths discharged today deaths in the city since includes old deaths,sadness
97,"['#unlock1', '#mumbai', '#dombivli', '#kalyan']",https://twitter.com/Mumbaikar_Bhau/status/1271105727424159744,unlock mumbai dombivli kalyan,neutral
98,"['#verosva', '#mumbai', '#beach', '#unlock1', '#unlockindia', '#unlockingindia', '#lockdownextended']",https://twitter.com/sajeshsudhanshu/status/1271091398142377984,watch new vlog cricket match at versova beach day via verosva mumbai beach unlock unlockindia unlockingindia lockdownextended,happiness
99,"['#amul', '#chinaindiaborder', '#dailybriefings', '#keralaelephantmurder', '#kanganaranaut', '#lockdown5', '#mumbai', '#unlock1', '#vijaymallya', '#whitelifematters']",https://twitter.com/R_P_Khare/status/1271059394134831104,and their styles are highly irritating i cannot tolerate them for more than minutes amul chinaindiaborder dailybriefings keralaelephantmurder kanganaranaut lockdown mumbai unlock vijaymallya whitelifematters,sadness
100,['#jantacurfew'],https://twitter.com/Samruddhak107/status/1271058118814777344,as a responsible citizen of maharashtra starting mumbai local and unlock is really working daily covid count rising more than k in mumbai itself jantacurfew is require for min days threatening life,neutral
101,"['#unlock1', '#socialdistancing', '#crowd', '#mumbai']",https://twitter.com/TheMahaMTB/status/1271048583479873536,unlock socialdistancing crowd mumbai,neutral
102,"['#india', '#delhi', '#mumbai', '#marinedrive', '#lockdown', '#unlock1', '#unlockindia', '#beforeafter', '#covid__19', '#coronavirusupdates']",https://twitter.com/Odisha_Tweets/status/1271044024036519936,glimpses of life before and after unlock via india delhi mumbai marinedrive lockdown unlock unlockindia beforeafter covid coronavirusupdates,neutral
103,"['#update', '#mumbaisaga', '#unlock1', '#emraanhashmi', '#mumbaisaga', '#hyderabad', '#mumbai', '#bollywood', '#shooting', '#johnabraham', '#movietalkies', '#thursdayvibes']",https://twitter.com/MovieTalkies/status/1271039054683836416,update and s mumbaisaga among the first films to resume shoot in unlock gearing up for days hyderabad schedule in july emraanhashmi mumbaisaga hyderabad mumbai bollywood shooting johnabraham movietalkies thursdayvibes,neutral
104,"['#mumbai', '#unlock1', '#shotononeplus7pro']",https://twitter.com/krunaljoshii/status/1271036483227377664,never imagined bandra station to be this empty mumbai unlock shotononeplus pro at bandra railway station,sadness
105,"['#mumbai', '#unlock1', '#coronalockdown', '#મુંબઈ', '#કોરોના']",https://twitter.com/chitralekhamag/status/1271035093574807553,mumbai unlock coronalockdown,neutral
106,['#unlock1'],https://twitter.com/AnkitMadX/status/1271034504992272384,unlock stuck at bandra highway flyover for over mins as some work is on can t get away from mumbai traffic,sadness
107,"['#taxis', '#mumbai', '#lockdown', '#unlock1']",https://twitter.com/latestly/status/1271027081271369728,kaali peeli taxis in mumbai continue to face lockdown blues with minimal bookings even after unlock,neutral
108,"['#mumbai', '#social']",https://twitter.com/thebollybaba/status/1271013783415087104,maharashtra covid mumbai social distancing unlock,neutral
109,"['#crispedit', '#marinedrive', '#thedraft', '#unlock1', '#covid19', '#georgefloyd', '#blacklivesmatter']",https://twitter.com/TheDraftWorld/status/1270986581294215168,crispedit sections of the media social media across india have been going overboard with crowds at marinedrive in mumbai instead of looking at the silver linings across the entire zone thedraft unlock covid georgefloyd blacklivesmatter,neutral
110,"['#unlockingus', '#unlockindia', '#unlock1']",https://twitter.com/AlokShukla1929/status/1270979217614729216,unlockingus unlockindia unlock this is the ground situation of mumbai in unlock at bandstand promenade,neutral
111,"['#bipashabasu', '#karansinghgrover', '#unlock1', '#mumbai']",https://twitter.com/HydTimes/status/1270977818592194560,shares a video of playing the mouth organ while enjoying the breeze the sun bipashabasu karansinghgrover unlock mumbai,happiness
112,[],https://twitter.com/PraakashRenose/status/1270953340273192961,mumbaiwindowclickunlock lockdown,neutral
113,['#unlock1'],https://twitter.com/aishwar2414/status/1270936469025120257,mumbai ki bhi halat patli ho chuki hai aur ab is halaat me unlock karna thoda sawaal maha sarkar sey bhi kariye,neutral
114,"['#quarantinetimepass', '#unlock2', '#unlock1', '#gujarat', '#maharashtra', '#lockdown5', '#bangalore', '#coimbatore', '#indianairforce', '#karachi', '#katrinakaif', '#mumbairains', '#mumbai', '#sidnaaz', '#upsc', '#voguechallenge', '#missyouyuvi']",https://twitter.com/GautamGada1/status/1270934682943647744,quarantine ward life of gujjus gujjus can be happy anywhere retweet quarantinetimepass unlock unlock gujarat maharashtra lockdown bangalore coimbatore indianairforce karachi katrinakaif mumbairains mumbai sidnaaz upsc voguechallenge missyouyuvi,worry
115,"['#beginagain', '#mumbai', '#best', '#mumbai', '#covid_19', '#unlock1', '#rjrohini', '#sachinkalbag', '#strike']",https://twitter.com/rotalks/status/1270928794916798464,beginagain mumbai best buses have threatened to go on strike and we may be the reason for it i find out more with of on mumbai covid unlock rjrohini sachinkalbag strike,worry
116,"['#unlock1', '#lockdown', '#corona', '#covid19', '#mumbai', '#covid', '#covid', '#china']",https://twitter.com/BansalNewsbpl/status/1270921253956677632,unlock lockdown corona covid mumbai covid covid china,neutral
117,"['#lockdown', '#mumbaifightscorona', '#unlock1', '#cautionyespanicno', '#coronavirusoutbreak']",https://twitter.com/TOIMumbai/status/1270900527992205312,if you are missing the toi s print edition in the lockdown click here to read the toi epaper and your city edition mumbaifightscorona unlock cautionyespanicno coronavirusoutbreak,neutral
118,"['#coronavirus', '#india', '#indiafightscorona', '#stayhome', '#mumbai', '#unlock1', '#lockdown', '#delhi']",https://twitter.com/FoxBat_IND/status/1270789251345584128,anyone who says we have to learn to live with this coronavirus in india needs to check the nos below and we haven t even spoken abt the elderly malnourished so how many are we willing to let die indiafightscorona stayhome mumbai unlock lockdown delhi,happiness
119,"['#maharashtra', '#tweet', '#twitter', '#vitorr', '#india', '#mumbai', '#coronavirus', '#covid19', '#unlock1', '#news', '#onlinemarketing', '#share', '#follow']",https://twitter.com/AnkitSh39191021/status/1270777212174647297,in maharashtra new cases were found in hours with deaths the highest figure tweet twitter vitorr india mumbai coronavirus covid unlock news onlinemarketing share follow,neutral
120,['#unlock1'],https://twitter.com/spacepirate420/status/1270776048129421312,mumbai mein public aise ghoom rahi hai jaise inlogo ne gharpe hi vaccine bana liya ho unlock,neutral
121,"['#covid_19', '#coronavirus', '#mumbailockdown', '#june9', '#maharastra', '#mumbai', '#maharashtrafightscorona', '#indiafightscovid19', '#breaking_news', '#lockdown5', '#unlock1']",https://twitter.com/ItvBharat/status/1270766884003045376,covid coronavirus mumbailockdown june maharastra mumbai maharashtrafightscorona indiafightscovid breaking news lockdown unlock,neutral
122,"['#unlock1', '#ghatkopar', '#mumbai', '#stayhomestaysafe', '#unlockchallenge']",https://twitter.com/chheda_pravin/status/1270764742286512128,after unlock in a day cases in ghatkopar mumbai stayhomestaysafe unlockchallenge,neutral
123,"['#mumbai', '#maharashtra', '#unlock1']",https://twitter.com/PriyaDalal_/status/1270752900927684616,it s pathetic state of affairs mumbai maharashtra unlock,sadness
124,"['#lamborghini', '#unlock1', '#automotive', '#news', '#topgear']",https://twitter.com/TopGearMagIndia/status/1270746373508366336,the reopening of its mumbai delhi and bengaluru dealerships comes with stringent adherence to the lamborghini sicurezza guidelines lamborghini unlock automotive news topgear,neutral
125,"['#indiafightscorona', '#covid19', '#stayhome', '#staysafe', '#mumbaitraffic', '#coronavirus', '#unlock1']",https://twitter.com/farzi_gyaan/status/1270745276752334856,mumbai the city never stops sleeps corona i like and respect your spirit mumbai but i am not here to see your stupid stunt stay home indiafightscorona covid stayhome staysafe mumbaitraffic coronavirus unlock,joy
126,"['#dabbawalas', '#mumbai', '#pandemic', '#coronavirus', '#lockdown', '#streetfood', '#localtrain', '#unlock1', '#coronavirusupdates']",https://twitter.com/BT_India/status/1270744938800541696,dabbawalas of mumbai rendered jobless struggle to survive amid pandemic coronavirus lockdown streetfood localtrain unlock coronavirusupdates link,sadness
127,"['#follow', '#memes', '#like', '#comment', '#spreadit', '#covid19', '#coronavirusmeme', '#coronavírus', '#corona', '#coronavirus', '#coronamemes', '#covid19pandemic', '#mumbai', '#marinedrive', '#maharashtra', '#maharashtrianmemes', '#marathimemes', '#mumbaimemes', '#mumbaikar', '#unlock1']",https://twitter.com/postistan/status/1270738467316568064,follow for more memes do like comment spreadit covid coronavirusmeme coronavrus corona coronavirus coronamemes covid pandemic mumbai marinedrive maharashtra maharashtrianmemes marathimemes mumbaimemes mumbaikar unlock,neutral
128,"['#mumbai', '#gatewayofindia', '#unlock1', '#mumbairains', '#maharashtra']",https://twitter.com/MahtabS81714506/status/1270735211727187968,mumbai gatewayofindia unlock mumbairains maharashtra,neutral
129,"['#ranked', '#unlock1']",https://twitter.com/prasadk2k/status/1270728677161132034,ranked quite low in deaths and critical patients next weeks critical as the effect of unlock starts to emerge mumbai seems to have slowed down but too early to call it out as it just opened up this week,sadness
130,"['#unlock', '#unlockindia', '#unlock1', '#india', '#lockdown', '#jatraa', '#covid19', '#pandemic', '#mumbai', '#maharashtra', '#corona', '#coronavirus']",https://twitter.com/jatraacomm/status/1270724975868051457,unlock india unlock unlockindia unlock india lockdown jatraa covid pandemic mumbai maharashtra corona coronavirus,neutral
131,['#unlock1'],https://twitter.com/IndianExpress/status/1270718482972172291,life before and after unlock more people were out on the streets and traffic snarls made a comeback this combination picture shows mumbai s marine drive before and after lockdown see more,sadness
132,"['#मुंबई', '#coronavirus', '#corona', '#unlock1']",https://twitter.com/airnews_mumbai/status/1270714289473482758,coronavirus corona unlock,neutral
133,"['#unlock1', '#unlockyouropportunity', '#realestate', '#realestatetips', '#bestinvestment', '#investmentproperty', '#property', '#businessideas', '#business', '#positivesteps', '#ideasforhome', '#bestdeals', '#bkandharigroup', '#mumbai']",https://twitter.com/BKandhari_Prop/status/1270710238216220676,now opportunity has been unlocked to invest in home secured your life unlock unlockyouropportunity realestate realestatetips bestinvestment investmentproperty property businessideas business positivesteps ideasforhome bestdeals bkandharigroup mumbai,worry
134,"['#rich', '#poor', '#mumbai', '#maharashtrapolitics', '#lockdown', '#unlock1']",https://twitter.com/shucoyan/status/1270709772900130822,reality rich poor mumbai maharashtrapolitics lockdown unlock,sadness
135,"['#bansharingautos', '#mumbai', '#covid19', '#covid19mumbai', '#unlock1', '#stayhomestaysafe']",https://twitter.com/harjotmankoo/status/1270706091601489920,why are the cops and government allowing sharing autos to run where is the common sense bansharingautos mumbai covid covid mumbai unlock stayhomestaysafe,sadness
136,['#unlock1'],https://twitter.com/republic_glitz/status/1270686901633253376,rakul preet singh goes cycling on mumbai streets addresses fans concern about mask unlock,neutral
137,"['#अमरावती', '#टाळेबंदी', '#सूट', '#मजूर', '#unlock1', '#covid__19', '#coronavirus']",https://twitter.com/airnews_mumbai/status/1270686635349487617,unlock covid coronavirus,neutral
138,"['#pickup', '#olagarage', '#care', '#car', '#problem', '#callus', '#wednesdaythoughts', '#quarantine', '#carchecking', '#carservices', '#lockdownend', '#unlock1', '#navimumbai', '#mumbai', '#delhi', '#pune', '#cars', '#problems']",https://twitter.com/Olagarage/status/1270679745848651778,for any car maintenance and service please call us on or log in to pickup olagarage care car problem callus wednesdaythoughts quarantine carchecking carservices lockdownend unlock navimumbai mumbai delhi pune cars problems,worry
139,['#unlock1'],https://twitter.com/AnkitMadX/status/1270675065697337344,unlock mumbai dark red from bandra to andheri at in the evening god bless us,neutral
140,"['#unlock1', '#staysafe']",https://twitter.com/TataMumMarathon/status/1270658375974391808,stepping out of the house don t forget to wear a mask and follow social distancing norms at all times act responsibly and reset normalcy unlock staysafe,sadness
141,"['#thetintedclub', '#ttccares', '#eyecareisselfcare', '#covid_19', '#ttc', '#bestintown', '#healthawareness', '#unlock1', '#protecteyes', '#eyeprotection', '#protectiveglasses', '#safety', '#safetyglasses', '#covid19', '#safetycomesfirst', '#ttc', '#lockdownindia', '#bestintown', '#bandra', '#mumbai']",https://twitter.com/ClubTinted/status/1270655851401867265,stay tuned for such regular updates thetintedclub ttccares eyecareisselfcare covid ttc bestintown healthawareness unlock protecteyes eyeprotection protectiveglasses safety safetyglasses covid safetycomesfirst ttc lockdownindia bestintown bandra mumbai,neutral
142,['#unlock1'],https://twitter.com/anujgcasting/status/1270654990198030336,mumbai ka unlocked dekh ke maine extra underwear khareed le hai living like a primitive human your life is your responsibility unlock,happiness
143,['#unlock1'],https://twitter.com/NaviMumbaiCity/status/1270650638527954948,sir agreed to your statement but if it continues this way the cases will increase exponentially and it will be far too much for us to handle as it is already and then we can officially rename from unlock to bhagwan bharose,worry
144,"['#delhi', '#mumbai', '#covid19india', '#unlock1', '#nagpur']",https://twitter.com/Priyanka_208/status/1270644614740021250,your are saying that she returned from delhi while is saying that she came from mumbai what is the truth pls clarify awaiting ur response covid india unlock nagpur,worry
145,"['#unlockingindia', '#unlock1']",https://twitter.com/SilpyGupta/status/1270642267712356353,its really scary unlockingindia unlock mumbai with coronavirus cases crosses wuhan,worry
146,"['#msmes', '#mumbai', '#offices', '#publicrelations', '#pr', '#b2bpr', '#b2b', '#msmes', '#mumbai', '#news', '#media', '#spincommunique', '#unlock1', '#coronavirus', '#covid19', '#wfh']",https://twitter.com/SpinCommunique/status/1270628682269253632,msmes in mumbai apprehensive about opening offices with staff b b msme publicrelations pr b bpr b b msmes mumbai news media spincommunique unlock coronavirus covid wfh,happiness
147,"['#lockdownend', '#unlock1', '#failedlockdown', '#mumbai', '#covid19india']",https://twitter.com/manasii_d/status/1270628669543682049,inspite having a large number of covid cases hundreds of mumbaikars flocked to marine drive as soon as the government announced unlock india spirit of mumbai or stupidity lockdownend unlock failedlockdown mumbai covid india,happiness
148,"['#unlock1', '#mumbai', '#covid19india', '#mumbaifightscovid19']",https://twitter.com/aishwar2414/status/1270617203847487488,please lockdown mumbai till st june pvt companies are calling employees to work we all know transportation conditions here and what it can lead to in coming days our families and mumbai will be in danger do think unlock mumbai covid india mumbaifightscovid,worry
149,"['#anonymous', '#break_the_silence', '#covid19india', '#covid_19', '#fleets', '#fleetsfeedback', '#fleet', '#fleeting', '#goodmorning', '#johnnydepp', '#mumbai', '#mondaythoughts', '#neetpostpone', '#onlyfans', '#quotes', '#rock', '#shopian', '#shehnaazgill', '#twitterfleets', '#unlock1', '#uttarpradesh', '#vocalforlocal', '#wednesdaymorning']",https://twitter.com/SMWPramesh/status/1270616195977424897,anonymous break the silence covid india covid fleets fleetsfeedback fleet fleeting goodmorning johnnydepp mumbai mondaythoughts neetpostpone onlyfans quotes rock shopian shehnaazgill twitterfleets unlock uttarpradesh vocalforlocal wednesdaymorning,neutral
150,"['#coronavirusoutbreak', '#unlock1', '#mumbai', '#wuhan']",https://twitter.com/NavbharatTimes/status/1270615831219593216,coronavirusoutbreak unlock mumbai wuhan,neutral
151,"['#mumbai', '#delhi', '#unlock1', '#covid']",https://twitter.com/MandloiRashmi/status/1270600752025788417,hospital beds not available for the rich too mass suicide mission on in mumbai delhi with unlock i can have every possibility of catching covid as economy opens but zero possibility of finding a bed that can give me a fighting chance to combat this virus,sadness
152,"['#children', '#competition', '#wednesdaymorning', '#twitterfleets', '#unlock1', '#onlyfans', '#facebook', '#flowers', '#carryminati', '#nature', '#mumbai', '#voguechallenge', '#blackpinkiscoming', '#jo1withフレハンディファン', '#fleets', '#indianarmy', '#fleeting', '#wednesdaymotivation']",https://twitter.com/ketanbhalala/status/1270599989463519232,future kid s homework children competition wednesdaymorning twitterfleets unlock onlyfans facebook flowers carryminati nature mumbai voguechallenge blackpinkiscoming jo with fleets indianarmy fleeting wednesdaymotivation,neutral
153,"['#retail', '#unlock1', '#mumbai', '#bmc']",https://twitter.com/THMumbai/status/1270598943613890560,retail unlock shops in mumbai can now stay open throughout the day instead of from a m to p m as per a revised order issued by the bmc reports,worry
154,['#unlock1'],https://twitter.com/loniless_18/status/1270598001870831622,unlock migrants returning to mumbai,neutral
155,"['#mumbaiunlock', '#unlock1']",https://twitter.com/mid_day/status/1270596731307282433,mumbai lockdown shops timings extended but malls to remain shut mumbaiunlock unlock,neutral
156,"['#unlock1', '#delhi', '#mumbai', '#selfquarantine', '#radhikamadan', '#bollywood', '#lockdown', '#coronaviruspandemic']",https://twitter.com/DelhiTimesTweet/status/1270585942399647746,unlock who recently flew to delhi from mumbai reunites with her mom after days of selfquarantine radhikamadan bollywood lockdown coronaviruspandemic,worry
157,['#unlock1'],https://twitter.com/sandesh_samant/status/1270585074602344448,can we now go from mumbai to pune by a private vehicle without any permit unlock,sadness
158,[],https://twitter.com/ComradeAbhi/status/1270583823550615552,where ever you are in india stay safe mumbai and delhi becoming indian wuhan city so stay at home obey govt guidelines please dont gather at one place we have to live for our country till now corona hasn t gone dont take unlock loosely,worry
159,"['#unlock1', '#rakulpreetsingh']",https://twitter.com/boxofficeindia/status/1270581991352623109,unlock goes out cycling on the streets of mumbai rakulpreetsingh,neutral
160,"['#beginagain', '#mumbai', '#unlock1', '#lockdown5']",https://twitter.com/AProudIndian8/status/1270574658698522624,says mission beginagain private offices say come to work our housing society says no entry for people who are stuck out of mumbai and want to resume work what to do unlock lockdown,sadness
161,"['#bandra', '#mumbai', '#unlock1']",https://twitter.com/sachinmedhekar/status/1270573219804786688,traffic on western express highway going towards bandra mumbai unlock,neutral
162,"['#mumbai', '#unlock1']",https://twitter.com/sachinmedhekar/status/1270571990534012931,traffic on western express highway toward borivali mumbai unlock,neutral
163,['#unlock1'],https://twitter.com/SuhasVaidya31/status/1270569733323198464,mumbai with coronavirus cases crosses wuhan unlock,neutral
164,"['#lockdown5', '#unlock1', '#mumbai', '#thane']",https://twitter.com/LoksattaLive/status/1270562770589609990,lockdown unlock mumbai thane,neutral
165,"['#hotelsandmallstart', '#rulesofsurvival', '#unlock1', '#fleetsfeedback', '#coronavirus', '#fleet', '#wednesdaymorning', '#sunshinejunday', '#fleeting', '#covidー19', '#duncanwilliams']",https://twitter.com/VantasMumbai/status/1270561080125906946,hotelsandmallstart rulesofsurvival unlock fleetsfeedback coronavirus fleet wednesdaymorning sunshinejunday fleeting covid duncanwilliams,neutral
166,"['#johnshopkins', '#india', '#coronavirus', '#covid', '#indiafightscorona', '#delhi', '#mumbai', '#unlock1', '#missionbeginagain']",https://twitter.com/kunnal/status/1270559917192044545,johnshopkins professor says india in all probability among those countries either not reporting or if it all reporting suspicious data for coronavirus are you surprised covid indiafightscorona delhi mumbai unlock missionbeginagain,neutral
167,['#unlock1'],https://twitter.com/idemitc/status/1270547794869313536,bus crowds push maharashtra govt into reviewing its unlock move mumbai news times of india unlock,neutral
168,"['#unlock1', '#mumbaikars', '#mumbai', '#backtowork']",https://twitter.com/gyan_duu/status/1270547675172048897,couldn t resist in sharing this forward unlock mumbaikars mumbai backtowork,joy
169,"['#lockdownextended', '#unlock1', '#mumbai']",https://twitter.com/rupadhikari/status/1270541655829917697,land owner asking to evacuate within days from now what to do lockdownextended unlock mumbai,neutral
