,hashtags,link,tweet,sentiment
257,['#unlock1'],https://twitter.com/ketan25shah/status/1270032256611082256,we request you start mumbai local to avoid rushing on mumbai roads and buses and to maintain social distancing it will help to divind the public piyushgoyal unlock,neutral
258,"['#unlock2', '#unlock1']",https://twitter.com/zzzubair/status/1270029927690035202,as recd on whatsapp claimed to be of mumbai unlock day unlock unlock,neutral
259,"['#lockdown', '#unlock', '#unlock1', '#indiaunlock', '#delhi', '#mumbai', '#dogs', '#straydog', '#doglove', '#humananimallove', '#wondering', '#awara_fotugrapher', '#mainbhihuawara']",https://twitter.com/kapoordipanshu1/status/1270029800330190848,they also wondering where are humans delhi india lockdown unlock unlock indiaunlock delhi mumbai dogs straydog doglove humananimallove wondering awara fotugrapher mainbhihuawara,neutral
260,"['#unlock2', '#mumbai', '#unlock1']",https://twitter.com/rama2091/status/1270027629861597184,after spending bucks on today s travel i have sent message to hr requesting them to close salary account directly credit my salary into ola wallet as nothing will be left after that unlock mumbai unlock,sadness
261,"['#mumbai', '#coronavirus', '#unlock1']",https://twitter.com/MumbaiLiveNews/status/1270027444150550528,mumbai coronavirus unlock,neutral
262,"['#footballer', '#covid19', '#unlock1', '#chiyaan']",https://twitter.com/rizvitaus/status/1270026104577785856,can you stay days indoor without stepping out every person had a lockdown story this ghanian footballer who was stuck at mumbai airport for days too has one watch the full interview on the sports journalist covid unlock chiyaan,sadness
263,"['#unlock1', '#delhi', '#mumbai']",https://twitter.com/Soldier_forlife/status/1270025876252397568,all social distancing norms being thrown to the wind as india sees the first day of unlock some of it unavoidable in a country like ours what do u think is going to happn whn metro starts in delhi local trains in mumbai as they eventually must citizen initiatives required,worry
264,"['#mumbai', '#mumbailockdown', '#unlock1', '#fightagainstcovid19']",https://twitter.com/neeru_za/status/1270014980713099264,total covid cases in mumbai crosses mark maharashtra tally at mumbai witnesses huge surge in traffic on st day of unlock mumbai mumbailockdown unlock fightagainstcovid,neutral
265,"['#unlock1', '#dharavi', '#mumbaifightscovid19']",https://twitter.com/PrithvirajM25/status/1270012312749879296,no deaths covid cases reported in dharavi area of mumbai today total number of cases in the area is now at including deaths brihanmumbai municipal corporation unlock dharavi mumbaifightscovid,sadness
266,"['#mumbai', '#coronavirus', '#dadar', '#unlock1']",https://twitter.com/CNBCTV18News/status/1270009390016237568,mumbai the city worst hit by coronavirus in india is only taking baby steps at re opening reports from what was once a bustling market in dadar as some small businesses attempt to limp back to life unlock,neutral
267,"['#sunset', '#unlock1', '#mumbai', '#thememoryalbum', '#photography', '#photographer']",https://twitter.com/thememoryalbum/status/1270008544281219072,stepped out of the house after days for a quick walk to the beach and i was greeted with this beauty stood there in awe and watched the sunset hope is all we have hang in there unlock mumbai thememoryalbum photography photographer,happiness
268,"['#mumbai', '#unlock1']",https://twitter.com/sameeratweeter/status/1270006116773236736,all eating outlets open but strictly take away n home delivery mumbai unlock,happiness
269,['#unlock1'],https://twitter.com/ashishlh/status/1270004033193984000,sir health infra bed scarcity in metros especially mumbai delhi is in extremely alarming why is that govt is not preparing enough make shift hospitals how well is india prepared for unlock will come to know in few days time the real battle of common man now begins,worry
270,"['#mumbai', '#coronavirus', '#unlock1']",https://twitter.com/RJKaran911/status/1270003696668155904,just in mumbai crosses k cases of coronavirus and today being the first phase of unlock and looking at people waiting with no social distance and without mask im worried,worry
271,"['#unlock2', '#ghazal', '#nidafazli', '#alhadkashikar', '#unlock1', '#mumbai', '#monsoon', '#lockdown']",https://twitter.com/GhazalForSoul/status/1270002751724896256,unlock ghazal by nidafazli ji sung by alhadkashikar ji from our album nida between the lines subscribe unlock mumbai monsoon lockdown,neutral
272,"['#unlock1', '#coronavirus', '#mumbai', '#cricket']",https://twitter.com/mataonline/status/1269999905650556928,unlock coronavirus mumbai cricket,neutral
273,"['#marinedrive', '#unlock1', '#coronavirus']",https://twitter.com/pratwah/status/1269999785680891910,they do say mumbai spirit is infectious marinedrive unlock coronavirus,neutral
274,['#unlock1'],https://twitter.com/CNBCTV18Live/status/1269995850282881026,coming up at pm inside saravana bhavan in chennai forum mall in bengaluru dadar market in mumbai and select city mall in delhi we bring you special reports on how day one of unlock panned out,neutral
275,"['#mumbai', '#unlock1', '#trafficupdate', '#mumbaitraffic']",https://twitter.com/nitesh30dubey/status/1269994331676397568,mumbai unlock trafficupdate mumbaitraffic,neutral
276,"['#unlock1', '#covid__19']",https://twitter.com/CEncroachment/status/1269992624708034560,state govt should know that it is impossible to maintain social distance with respect to public transport in the city of mumbai with the kind of infra we have the number of people we cater to its impossible unlock covid,sadness
277,"['#lockdown5', '#unlock1', '#mumbairains', '#mumbai']",https://twitter.com/biybalu/status/1269992417316372480,no need to hurry take it easy while opening hotels restaurant malls theatre s think ten time s lockdown unlock mumbairains mumbai,happiness
278,"['#unlock1', '#coronavirus', '#covid19', '#mumbai']",https://twitter.com/withSNirupam/status/1269990839599628288,unlock coronavirus covid mumbai,neutral
279,"['#unlock1', '#coronavirus', '#mumbai']",https://twitter.com/tVoiceOfCitizen/status/1269990595407339521,social distancing goes for a toss is this unlock coronavirus seems to have no effect on them risking their own lives that s mumbai the city which never sleeps,neutral
280,['#unlock1'],https://twitter.com/CEncroachment/status/1269990164845264897,is it possible to get an justification from asking why havent they removed these illegal encroachments on the mumbai central flyover unlock,worry
281,"['#covid19india', '#maharashtra', '#mumbai', '#lockdownfailed', '#godsaveusall', '#godblessall', '#unlock1']",https://twitter.com/vg3875/status/1269987690902024193,rise and shine covid india maharashtra mumbai lockdownfailed godsaveusall godblessall unlock,neutral
282,"['#unlock1', '#beginagain', '#mumbai', '#lockdown']",https://twitter.com/echoman911/status/1269986959570530306,double edged sword our unlock beginagain mumbai with some many out after umpteen days of lockdown it s like multiple exxon valdez spills of humans cars and everything,sadness
283,"['#coronaexpress', '#socialdistancing', '#mumbai', '#bestcm', '#unlock1', '#bhagwanbharose1']",https://twitter.com/LotusBharat/status/1269984077752516609,wah just see the clamour of ppl who are dying to get into coronaexpress did someone mention socialdistancing mumbai bestcm unlock bhagwanbharose,worry
284,"['#unlock1', '#lockdown5', '#covid19india', '#coronavirus']",https://twitter.com/badpaps/status/1269984063097499650,mumbai people are unlocking really well unlock lockdown covid india coronavirus,sadness
285,"['#sakalnews', '#sakal', '#bestbuses', '#unlock1', '#mumbai', '#lockdown']",https://twitter.com/SakalMediaNews/status/1269981764870643712,sakalnews sakal bestbuses unlock mumbai lockdown,neutral
286,"['#unlock1', '#mumbai', '#socialdistancing', '#worldbestcm']",https://twitter.com/its_dsk/status/1269981204801077254,waah ji waaah unlock ka day in mumbai kya adbhut tareeke se socialdistancing ka paalan ho raha hai ab pata chala mumbai me sabse jyada cases kyon hain ab kuch log yahan bhi worldbestcm ka raag alaapne aayenge ground reality ko ignore karenge,happiness
287,"['#best', '#unlock1', '#bestbus', '#mumbai']",https://twitter.com/syedzama172/status/1269981029655289864,best unlock bestbus mumbai,neutral
288,"['#unlock2', '#unlock1']",https://twitter.com/commonmanspowar/status/1269978366939148288,unlock mumbai did you see social distancing nobody is serious about covid see if you can do anything it will drastically increase postive petient numbers in mumbai unlock unlock,joy
289,"['#mumbai', '#unlock1']",https://twitter.com/hsachdev/status/1269973872683646978,mumbai day of unlock happy days are here again,neutral
290,['#unlock1'],https://twitter.com/mangeshdigital/status/1269972413464207362,the only way to reduce the crowding in mumbai in this unlock is to allow people to travel inter district without e pass schools are online and people will prefer to go to their relatives in different districts,sadness
291,"['#mumbai', '#unlock1', '#days', '#mumbaifightscovid19']",https://twitter.com/Kiranghulepati1/status/1269966324278587394,bringing back the good old days mumbai unlock days mumbaifightscovid,happiness
292,['#unlock1'],https://twitter.com/i_amssp/status/1269966134373167105,mumbai public right now unlock,neutral
293,"['#localmemes', '#memes2020', '#unlock1', '#unlock2', '#shopping', '#malls', '#mumbai', '#pune', '#maharashtra', '#delhi', '#kolkata', '#westbengal', '#karnataka', '#tamilnadu', '#localsamosa']",https://twitter.com/LocalSamosa/status/1269965263652491264,localmemes mall owners right now memes unlock unlock shopping malls mumbai pune maharashtra delhi kolkata westbengal karnataka tamilnadu localsamosa,happiness
294,"['#lockdownfailed', '#covid19india', '#unlock1']",https://twitter.com/BirgeShadab/status/1269964538092441600,very sad news sir lockdown didn t worked as expected sir mumbai is leading lockdownfailed covid india and now there is unlock unlock,sadness
295,"['#itat', '#mumbai', '#incometax', '#tax', '#update', '#taxinbrief', '#unlock1']",https://twitter.com/taxinbrief/status/1269963408536993792,t income tax update mumbai itat l has issued a circular explaining modalities of functioning of virtual smc courts from th june to th june itat mumbai incometax tax update taxinbrief unlock,neutral
296,"['#mumbai', '#unlock1', '#traffic']",https://twitter.com/MumbaiLiveNews/status/1269962977114873856,mumbai unlock traffic,neutral
297,"['#missionbeginagain', '#unlock1', '#maharashtra']",https://twitter.com/deep9007/status/1269962330772631552,i think it is logical to ban the entry on such public places as i don t think mumbai is ready for such freedom still pls do something else we are staring at a really high numbers missionbeginagain unlock maharashtra,worry
298,[],https://twitter.com/LPornima/status/1269962241333329926,aur aap abhi filhal aapke farm house par na jao mahine jane dijiye kyu ki corona abhi bhi bahar faila hua hai bhalehi aaj se unlock start hua ho aap apna khayal rakhiye aur hum mumbai maharashtra k logo ko sabse jyada dhyan rakhna hai take care be safe love u,sadness
299,"['#unlock1', '#confidence']",https://twitter.com/Sharan_Nair93/status/1269961124515987463,i wish i had the self confidence of all the people roaming around without an ounce of fear such strong will and self belief they truly believe that wearing a paper thin face mask is the solution to an easily communicable disease ah mumbai meri jaan unlock confidence,joy
300,"['#mumbai', '#india', '#lockdown5', '#unlock1', '#covid19']",https://twitter.com/ICEXIndia/status/1269959648984981506,el confinamiento en mumbai se relaja la capital econmica de india comenz el de junio la vuelta a la normalidad permitindose la apertura de ciertos comercios y la circulacin entre distritos lockdown unlock covid para ms informacin,neutral
301,['#unlock1'],https://twitter.com/NehaPoonia/status/1269959068912771072,day of india lifting lockdown restrictions or unlock as govt is calling it saw more people visit places of worship than malls restaurants delhi mumbai also saw traffic jams after two and a half months im live next on w,sadness
302,"['#unlock1', '#covid19']",https://twitter.com/MumbaiMirror/status/1269958602694864896,mumbai is almost back on its feet unlock covid,neutral
303,"['#coronavirus', '#mumbai', '#lockdown', '#unlock1', '#maharashtra', '#lockdown5', '#pandemic', '#coronavirusupdates']",https://twitter.com/BT_India/status/1269957998178234373,coronavirus mumbai steps out after days of lockdown as city reopens unlock maharashtra lockdown pandemic coronavirusupdates link,neutral
304,"['#longqueues', '#bus', '#unlock1']",https://twitter.com/Scribbly_Scribe/status/1269957934848503810,longqueues at bus stop for with average waiting time of two hours before one can get in a bus most buses plying full don t stop as only one passenger per seat and five standing to maintain social distancing unlock,happiness
305,"['#mumbai', '#mumbaicorona', '#schoolreopening', '#newnormal', '#unlock2', '#unlock1', '#covid19', '#coronavirus']",https://twitter.com/iamvarunbajaj/status/1269956780500508672,the new normal is just like the old one sharing as received authenticity is still a question mumbai mumbaicorona schoolreopening newnormal unlock unlock covid coronavirus,happiness
306,['#unlock1'],https://twitter.com/_downandirty_/status/1269956161115246594,do you really think the city should have begin this unlock mumbai is worst hit please do not play with the people s lives like this,sadness
307,"['#sakal', '#sakalnews', '#missionbeginagain', '#unlock1', '#mumbai', '#marathinews']",https://twitter.com/SakalMediaNews/status/1269954372567355392,sakal sakalnews missionbeginagain unlock mumbai marathinews,neutral
308,"['#delhi', '#maharashtra', '#mumbai', '#unlock1', '#kejriwal', '#unlock2', '#schoolreopening', '#covid19india', '#coronavirusindia']",https://twitter.com/GAUTAMGUPTA10/status/1269953856550563846,specially in delhi maharashtra mumbai n densely spread states unlock kejriwal unlock schoolreopening covid india coronavirusindia,neutral
309,['#unlock1'],https://twitter.com/BWAutoworld/status/1269952510162358272,unlock all lamborghini dealerships in delhi mumbai and bangaluru are open for business with stringent adherence to the lamborghini sicurezza guidelines and govt directions read more,neutral
310,"['#mumbai', '#unlock1', '#covid14']",https://twitter.com/ZeeBusiness/status/1269952141335990272,best mumbai unlock covid,neutral
311,"['#unlock1', '#missionbeginagain', '#realtorlife', '#realtor', '#property', '#home', '#office', '#mumbai', '#thane', '#realtorsofinstagram', '#propertyfinder']",https://twitter.com/nileshamesar/status/1269952114182127616,the world is reopening so are we unlock missionbeginagain realtorlife realtor property home office mumbai thane realtorsofinstagram propertyfinder,neutral
312,"['#unlock1', '#unlock2', '#mumbai']",https://twitter.com/purohitvaibhav/status/1269951475234615297,this is mumbai social distancing is a joke unlock unlock mumbai,neutral
313,['#unlock1'],https://twitter.com/TheTrueIndian01/status/1269951376995442690,taking a day break from twitter as it is becoming a little toxic thanks to abuses on my dms from peacefools will be back with p of my thread also got loads of work to do now that we are in unlock mode in mumbai,neutral
314,"['#unlock1', '#unlockingindia', '#coronavirusindia']",https://twitter.com/razoredgeDM/status/1269949369932935168,only god can save mumbai unlock unlockingindia coronavirusindia,joy
315,"['#lockdown5', '#unlock1', '#mumbai', '#westernexpresshighway']",https://twitter.com/LoksattaLive/status/1269949231244050432,lockdown unlock mumbai westernexpresshighway,neutral
316,"['#mumbai', '#unlock1', '#missionbeginagain']",https://twitter.com/TheOfficialYogs/status/1269949229209841670,instead of sharing videos and criticizing your city try to support and educate people baki toh you can leave upto this phase of bhagwan bharose mumbai unlock missionbeginagain,joy
317,"['#mumbai', '#unlock1', '#missionbeginagain']",https://twitter.com/TheOfficialYogs/status/1269949050536656898,things are opening up once again there will be traffic jams like you got stuck in that jam all others are on their way to workplace everyone s hungry again for livelihood not even would be doing tp on a monday morning mumbai unlock missionbeginagain,sadness
318,"['#schoolreopening', '#arvindkejriwal', '#unlock1', '#mumbaikars']",https://twitter.com/shahvishu79/status/1269948965283389446,schoolreopening arvindkejriwal unlock mumbaikars stop this else mumbai is waiting for a big disaster in happening sad and worried to see this,worry
319,['#unlock1'],https://twitter.com/CNBCTV18News/status/1269948844818612224,unlock begins today malls religious places to remain shut in maharashtra gets a ground report from dadar west in mumbai an otherwise busy street,sadness
320,"['#unlock2', '#unlock1', '#mumbai', '#lockdownfailed']",https://twitter.com/iam_Beardcules/status/1269946818403667968,why did we have lockdown only to see this so well managed unlock unlock mumbai lockdownfailed,sadness
321,"['#unlock1', '#unlock2']",https://twitter.com/itssanjay__/status/1269944593228890117,unlock unlock people offering prayers at temples large no of people out for a walk at marine drive mumbai people not following social distancing norms modi ji,sadness
322,"['#unlock1', '#uddhavthackeray', '#arvindkejriwal']",https://twitter.com/NMFNewsOfficial/status/1269942701086121992,unlock corona case delhi mumbai unlock uddhavthackeray arvindkejriwal,neutral
323,"['#marinedrive', '#mumbai', '#covid__19', '#unlock1']",https://twitter.com/reena14777343/status/1269941716867354624,mumbai has highest number of corona cases and people want to stay fit by crowding not mainting social distancing and then blame government for increase in corona cases what surprises me is most of them are senior citizens marinedrive mumbai covid unlock,joy
324,"['#coronavirusindia', '#unlock1']",https://twitter.com/peyushkamal/status/1269941094780776448,what govt want to do mumbai open without local trains and delhi open without metro coronavirusindia unlock,sadness
325,"['#best', '#mumbai', '#unlock1']",https://twitter.com/PrahaarNews/status/1269938212643848192,read best mumbai unlock,neutral
326,"['#unlock1', '#unlock2', '#mondaythoughts', '#coronavirus', '#mumbai', '#india']",https://twitter.com/Shadabofficial/status/1269937868375547904,unlock unlock mondaythoughts coronavirus mumbai india,neutral
327,['#unlock1'],https://twitter.com/phones_wiki/status/1269937587134685184,mumbai mission begin again chokes eastern and western express highways during office hours unlock,neutral
328,"['#unlock2', '#unlock1', '#mondaythoughts', '#mumbai', '#coronavirusindia', '#covid_19', '#lockdownend', '#lockdownindia']",https://twitter.com/AnaghaArdalkar/status/1269933468193976322,unlock unlock mondaythoughts mumbai coronavirusindia covid lockdownend lockdownindia,neutral
329,"['#unlock2', '#unlock1', '#coronavirus']",https://twitter.com/softengineer20/status/1269932032299339778,unlock unlock coronavirus muslims offering namaz at mosques large no of people out for a walk at marine drive mumbai people not following social distancing norms modi ji,sadness
330,['#unlock1'],https://twitter.com/pinkeshpinkesh/status/1269931785737011202,mumbai day unlock,neutral
331,"['#unlock1', '#unlock2', '#coronavirus', '#covid', '#worldoceanday2020', '#mumbai']",https://twitter.com/FishyRishi/status/1269928205160460288,the last day of lockdown the last day nature gets to breathe unlock unlock coronavirus covid worldoceanday mumbai,sadness
332,"['#mumbai', '#unlock1']",https://twitter.com/proxax/status/1269926513832534016,wtf mumbai unlock,neutral
333,"['#unlock1', '#mumbai']",https://twitter.com/ganeshmpandey/status/1269926246789509122,unlock in mumbai,neutral
334,"['#unlock1', '#unlock2', '#delhi', '#maharashtra', '#mumbai', '#arvindkejriwal', '#bhaktmukherjee', '#modibetrayedindia']",https://twitter.com/BhaktMukherjee/status/1269925935488348161,maharashtra an indian state has crossed china in terms if covid infection the govt is pushing us to the jaws of death with its useless lockdown shame unlock unlock delhi maharashtra mumbai arvindkejriwal bhaktmukherjee modibetrayedindia,sadness
335,"['#coronavirus', '#unlock1']",https://twitter.com/ArreTweets/status/1269925258804461573,mumbai s coronavirus cases have surpassed but the first day of unlock has already seen heavy traffic on western express highway office going people have little choice but those at marine drive can save their fitness goals for another day,sadness
336,"['#staysafestayhealthy', '#unlock1', '#followme']",https://twitter.com/Indradev_007/status/1269924968701231106,mumbai gt hospital covid ward no conditions of washroom no water staysafestayhealthy unlock followme,neutral
337,"['#unlock1', '#unlock2', '#covid19', '#coronavirusindia', '#mumbai', '#marinedrive', '#india', '#bombay', '#paperboy', '#paperboyapp', '#awarnessredefined']",https://twitter.com/PaperboyOnline/status/1269923826546008066,corona drive crowd at marine drive in unlock is proof we are not taking covid seriously read more about it on paperboyapp download now unlock unlock covid coronavirusindia mumbai marinedrive india bombay paperboy paperboyapp awarnessredefined,worry
338,"['#unlock2', '#mumbai', '#covid19', '#coronavirus', '#indiafightscoronavirus', '#unlock1']",https://twitter.com/akash_devgude/status/1269922552161300480,unlock mumbai covid coronavirus indiafightscoronavirus unlock everyone is exposed,neutral
339,"['#spiritofmumbai', '#rambharose1']",https://twitter.com/rupesh1729/status/1269920424655310849,mumbai is looking to go back to normal while corona is still out there and then it s called spiritofmumbai it s not unlock it s rambharose,worry
340,"['#missionbeginagain', '#unlock1', '#mumbai', '#thane']",https://twitter.com/LeoThomasekar/status/1269920225819889667,crowd at marine drive on sunday crowd today to get inside the bus with limited transport the st day itself led to chaos i don t know what will happen in next few days missionbeginagain unlock mumbai thane,worry
341,['#unlock1'],https://twitter.com/Manishkumbhar03/status/1269914419636523012,today i gota diffrent reply saying its functional in pune but mumbai its still not resumed what should i doo go to pune for all the way to repair my device how much patience i should have to get my device repair this is the first day for unlock,happiness
342,"['#corona', '#unlock1']",https://twitter.com/imlahoti/status/1269914329652105216,what is this complete chaos in mumbai local trains are not started but people are forced to come to office govt should either start the entire city or impose strict rules dont keep fellow citizens hanging in middle corona unlock,sadness
343,"['#mumbai', '#unlock1', '#unlockingindia']",https://twitter.com/knownaskarkera/status/1269913852633726977,now that best buses have started their services in mumbai heres a look at whats happening in the city fewer people following social distancing more lives at risk unlock unlockingindia,neutral
344,"['#throwback', '#traditionalwear', '#photoshoot', '#mondaythoughts', '#mondaymotivation', '#unlock1', '#fashionworld', '#fashionista', '#model', '#beauty', '#beautyqueens', '#beautyblogger', '#thane', '#mumbai', '#mumbaifashion', '#desigirl']",https://twitter.com/fashionistanik1/status/1269912673329639425,throwback traditionalwear photoshoot mondaythoughts mondaymotivation unlock fashionworld fashionista model beauty beautyqueens beautyblogger thane mumbai mumbaifashion desigirl,happiness
345,"['#mumbai', '#bestbuses']",https://twitter.com/mumbaitak/status/1269912332970442752,unlock mumbai best buses watch full story mumbai bestbuses,neutral
346,"['#unlock1', '#unlock1ishere', '#postcovid19', '#postcovid', '#gettingback', '#adfilms', '#productionhouse', '#tvcommercials', '#mumbai']",https://twitter.com/samirtewari/status/1269911877871521792,and we are back is now open again send us your scripts lets chat on how to make those projects happen or just call and lets chat about the future unlock unlock ishere postcovid postcovid gettingback adfilms productionhouse tvcommercials mumbai,worry
347,"['#traffic', '#mumbai', '#unlock1', '#covid19', '#healthcare']",https://twitter.com/Deb_Rc03/status/1269911146129059840,massive traffic jam observed on mumbai roads this is on st day of rd phase of unlock request to reverse its decision for opening private offices with staff lets first concentrate on covid and healthcare infra,sadness
348,"['#lockdown', '#unlock1', '#coronavirus', '#mumbai']",https://twitter.com/indiansighthub/status/1269910928348393472,people forgot that lockdown was unlock to focus on economy not to freely visit anywhere and do shopping coronavirus has effected worst in mumbai,neutral
349,"['#corona', '#unlock', '#unlock1', '#workfromhome', '#lockdown', '#india', '#shoopy', '#indiafightscorona', '#accounting', '#invoice', '#onlineshop', '#smallbusiness', '#shoopyapp', '#free', '#smallbusiness', '#supports', '#unlocking', '#chennai', '#banglore', '#hyderabad', '#mumbai', '#noida']",https://twitter.com/shoopyin/status/1269908789391765506,ndia unlock with strict rules and measures corona unlock unlock workfromhome lockdown india shoopy indiafightscorona accounting invoice onlineshop smallbusiness shoopyapp free smallbusiness supports unlocking chennai banglore hyderabad mumbai noida,neutral
